{
  "id": "0064-carnice-9b-q4km-code-nothink-run-command-tool-intent",
  "provenance": {
    "kind": "captured",
    "model": "carnice:9b-q4km-code-nothink",
    "runtime": "ollama",
    "harness": "ollama-api-generate",
    "prompt_id": "run-command-tool-intent",
    "temperature": "0",
    "captured": "2026-06-14",
    "source": "gpu-capture-panel raw=captures/raw/2026-06-14/carnice-9b-q4km-code-nothink/batch20/0064-run-command-tool-intent.txt meta=captures/raw/2026-06-14/carnice-9b-q4km-code-nothink/batch20/0064-run-command-tool-intent.json",
    "sampler": "temperature=0,num_predict=384"
  },
  "request_tools": [
    {
      "name": "run_command",
      "description": "Run a shell command.",
      "parameters": {
        "type": "object",
        "properties": {
          "command": {
            "type": "string"
          }
        },
        "required": [
          "command"
        ]
      }
    }
  ],
  "raw_output": "<think>\nOkay, so the user wants me to run the 'pwd' command. Let me think about how to approach this. The 'pwd' command stands for \"print working directory\" and is used in Unix-like operating systems to display the current directory path. Since I'm an AI assistant with access to a terminal via the run_command tool, I need to execute this command and return the output.\n\nFirst, I should check if there's any context or previous steps that might affect this. The user hasn't provided any additional information, so I can assume it's a straightforward request. The task is simple: execute 'pwd' and show the result.\n\nI need to make sure that the command is correctly formatted. The user specified 'pwd' without any arguments, which is correct because 'pwd' doesn't take parameters. So the command should be exactly 'pwd'.\n\nNext, I'll use the run_command tool with the command parameter set to 'pwd'. Once executed, the output will be the current working directory path. I need to present this output clearly to the user.\n\nWait, but as an AI, do I have access to a real terminal? The instructions mention using tools like run_command, which suggests that I can execute shell commands. So when I call run_command with 'pwd', it should return the actual current directory path where the command is being executed.\n\nI should also consider any possible errors. If there's an issue with permissions or the system, but since 'pwd' is a standard command, it's unlikely to fail unless the environment is restricted. But given that the user is asking for this, I can proceed under the assumption that the environment allows it.\n\nSo, the steps are: 1) Use the run_command tool with the command 'pwd'. 2) Capture the output. 3) Present the result to the user.\n\nI think",
  "taxonomy": [
    "prose_false_positive"
  ],
  "gold": {
    "type": "no_tool"
  },
  "note": "The output is leaked/incomplete reasoning and contains no final committed tool-call object; repairing it would act on thought text rather than an emitted call."
}
