{
  "id": "0042-qwen35-9b-q4km-chat-read-file-tool-intent",
  "provenance": {
    "kind": "captured",
    "model": "qwen35:9b-q4km-chat",
    "runtime": "ollama",
    "harness": "ollama-api-generate",
    "prompt_id": "read-file-tool-intent",
    "temperature": "0",
    "captured": "2026-06-14",
    "source": "gpu-capture-panel raw=captures/raw/2026-06-14/qwen35-9b-q4km-chat/batch20/0042-read-file-tool-intent.txt meta=captures/raw/2026-06-14/qwen35-9b-q4km-chat/batch20/0042-read-file-tool-intent.json",
    "sampler": "temperature=0,num_predict=384"
  },
  "request_tools": [
    {
      "name": "read_file",
      "description": "Read a text file by path.",
      "parameters": {
        "type": "object",
        "properties": {
          "path": {
            "type": "string"
          }
        },
        "required": [
          "path"
        ]
      }
    }
  ],
  "raw_output": "<think>\n\n</think>\n\n```json\n{\"name\": \"read_file\", \"arguments\": {\"path\": \"config/settings.toml\"}}\n```",
  "taxonomy": [
    "markdown_fenced_json"
  ],
  "gold": {
    "type": "tool_call",
    "name": "read_file",
    "arguments": {
      "path": "config/settings.toml"
    }
  },
  "note": "The emitted text contains a complete call-like markdown_fenced_json shape naming the offered tool with all gold arguments directly recoverable."
}
