{
  "id": "0103-gemma4-e4b-it-qat-write-file-tool-intent",
  "provenance": {
    "kind": "captured",
    "model": "gemma4:e4b-it-qat",
    "runtime": "ollama",
    "harness": "ollama-api-generate",
    "prompt_id": "write-file-tool-intent",
    "temperature": "0",
    "captured": "2026-06-14",
    "source": "gpu-capture-panel raw=captures/raw/2026-06-14/gemma4-e4b-it-qat/batch20/0103-write-file-tool-intent.txt meta=captures/raw/2026-06-14/gemma4-e4b-it-qat/batch20/0103-write-file-tool-intent.json",
    "sampler": "temperature=0,num_predict=384"
  },
  "request_tools": [
    {
      "name": "write_file",
      "description": "Write content to a file.",
      "parameters": {
        "type": "object",
        "properties": {
          "path": {
            "type": "string"
          },
          "content": {
            "type": "string"
          }
        },
        "required": [
          "path",
          "content"
        ]
      }
    }
  ],
  "raw_output": "{\"name\": \"write_file\", \"arguments\": {\"path\": \"notes/todo.txt\", \"content\": \"alpha beta\"}}",
  "taxonomy": [
    "json_in_content"
  ],
  "gold": {
    "type": "tool_call",
    "name": "write_file",
    "arguments": {
      "path": "notes/todo.txt",
      "content": "alpha beta"
    }
  },
  "note": "The emitted text contains a complete call-like json_in_content shape naming the offered tool with all gold arguments directly recoverable."
}
