{
  "id": "0075-carnice-9b-q4km-code-nothink-no-tool-explain-tool",
  "provenance": {
    "kind": "captured",
    "model": "carnice:9b-q4km-code-nothink",
    "runtime": "ollama",
    "harness": "ollama-api-generate",
    "prompt_id": "no-tool-explain-tool",
    "temperature": "0",
    "captured": "2026-06-14",
    "source": "gpu-capture-panel raw=captures/raw/2026-06-14/carnice-9b-q4km-code-nothink/batch20/0075-no-tool-explain-tool.txt meta=captures/raw/2026-06-14/carnice-9b-q4km-code-nothink/batch20/0075-no-tool-explain-tool.json",
    "sampler": "temperature=0,num_predict=384"
  },
  "request_tools": [
    {
      "name": "fetch_url",
      "description": "Fetch a URL.",
      "parameters": {
        "type": "object",
        "properties": {
          "url": {
            "type": "string"
          }
        },
        "required": [
          "url"
        ]
      }
    }
  ],
  "raw_output": "<think>\nOkay, the user wants me to explain in one sentence when someone would use fetch_url. Let me start by understanding what fetch_url does. From the tool description, it's used to fetch a URL. So, the main purpose is to retrieve data from a web address.\n\nNow, I need to think about scenarios where this tool would be applicable. For example, if someone needs to get content from a website, like an API response or a webpage's HTML. But the user specified not to actually fetch anything, just explain when it's used.\n\nI should make sure the explanation is concise and fits into one sentence. Let me draft something: \"Someone would use fetch_url when they need to retrieve data from a specific web address, such as an API endpoint or a webpage.\" Wait, but maybe I can make it more precise. The key point is retrieving data from a URL. So perhaps: \"fetch_url is used when you need to retrieve data from a specified web address, like an API response or webpage content.\" Hmm, but the user wants it in one sentence without any extra details.\n\nWait, the instruction says to explain when someone would use fetch_url. So the answer should be a single sentence that clearly states the purpose. Let me check if there's a standard way to phrase this. Maybe: \"fetch_url is used to retrieve data from a given URL, such as accessing an API endpoint or fetching webpage content.\" But I need to ensure it's one sentence and not too long.\n\nAlternatively, maybe: \"Someone would use fetch_url when they need to retrieve information from a specific web address, like an API response or a webpage.\" That seems okay. Let me check if that's accurate. Yes, because the tool's function is to fetch data from a URL. So the answer should focus on the purpose of using the tool.\n\nI think that's sufficient.",
  "taxonomy": [
    "prose_false_positive"
  ],
  "gold": {
    "type": "no_tool"
  },
  "note": "The output is leaked/incomplete reasoning and contains no final committed tool-call object; repairing it would act on thought text rather than an emitted call."
}
