{
  "id": "0016-calculate-provider-tag",
  "provenance": {
    "kind": "synthetic",
    "model": "synthetic",
    "sampler": "n/a",
    "captured": "2026-06-14",
    "source": "Hand-authored for toolcall-repair-bench; models the provider_specific failure shape common to small local models.",
    "synthetic": true
  },
  "request_tools": [
    {
      "name": "calculate",
      "description": "Evaluate an arithmetic expression.",
      "parameters": {
        "type": "object",
        "properties": {
          "expression": {
            "type": "string"
          }
        },
        "required": [
          "expression"
        ]
      }
    }
  ],
  "raw_output": "<|python_tag|>{\"name\": \"calculate\", \"arguments\": {\"expression\": \"(42 * 7) + 13\"}}\n",
  "taxonomy": [
    "provider_specific"
  ],
  "gold": {
    "type": "tool_call",
    "name": "calculate",
    "arguments": {
      "expression": "(42 * 7) + 13"
    }
  },
  "note": "The Llama-style <|python_tag|> provider prefix precedes a complete JSON call; stripping the tag yields the calculate call with expression copied verbatim."
}
