{
  "id": "0053-qwen35-9b-q4km-chat-no-tool-json-answer",
  "provenance": {
    "kind": "captured",
    "model": "qwen35:9b-q4km-chat",
    "runtime": "ollama",
    "harness": "ollama-api-generate",
    "prompt_id": "no-tool-json-answer",
    "temperature": "0",
    "captured": "2026-06-14",
    "source": "gpu-capture-panel raw=captures/raw/2026-06-14/qwen35-9b-q4km-chat/batch20/0053-no-tool-json-answer.txt meta=captures/raw/2026-06-14/qwen35-9b-q4km-chat/batch20/0053-no-tool-json-answer.json",
    "sampler": "temperature=0,num_predict=384"
  },
  "request_tools": [
    {
      "name": "search_web",
      "description": "Search the web.",
      "parameters": {
        "type": "object",
        "properties": {
          "query": {
            "type": "string"
          }
        },
        "required": [
          "query"
        ]
      }
    }
  ],
  "raw_output": "<think>\nThe user is asking me to show a JSON example of a book object with title and author fields. This doesn't require any web search or external tools - I can create this directly from my knowledge.\n\nLet me provide a simple, clear JSON example without using any tools since the user didn't ask for an external action.\n</think>\n\n```json\n{\n  \"title\": \"The Great Gatsby\",\n  \"author\": \"F. Scott Fitzgerald\"\n}\n```",
  "taxonomy": [
    "structured_data_no_intent"
  ],
  "gold": {
    "type": "no_tool"
  },
  "note": "The output directly answers or shows non-tool content; the tool name/text appears as content, not as an emitted call."
}
