{
  "id": "0146-gemma4-e2b-code-search-web-tool-intent",
  "provenance": {
    "kind": "captured",
    "model": "gemma4:e2b-code",
    "runtime": "ollama",
    "harness": "ollama-api-generate",
    "prompt_id": "search-web-tool-intent",
    "temperature": "0",
    "captured": "2026-06-14",
    "source": "gpu-capture-panel raw=captures/raw/2026-06-14/gemma4-e2b-code/batch20/0146-search-web-tool-intent.txt meta=captures/raw/2026-06-14/gemma4-e2b-code/batch20/0146-search-web-tool-intent.json",
    "sampler": "temperature=0,num_predict=384"
  },
  "request_tools": [
    {
      "name": "search_web",
      "description": "Search the web.",
      "parameters": {
        "type": "object",
        "properties": {
          "query": {
            "type": "string"
          }
        },
        "required": [
          "query"
        ]
      }
    }
  ],
  "raw_output": "```json\n{\n\"tool_call\":{\n\"name\":\"search_web\",\n\"parameters\":{\n\"query\":\"llama.cpp Gemma 4 context window\"\n}\n}\n```",
  "taxonomy": [
    "truncated_tool_call"
  ],
  "gold": {
    "type": "tool_call",
    "name": "search_web",
    "arguments": {
      "query": "llama.cpp Gemma 4 context window"
    }
  },
  "note": "The output is malformed/truncated fenced JSON, but the offered tool name and required query argument are present."
}
