{
  "id": "0099-carnice-9b-q4km-multiple-tools-floated",
  "provenance": {
    "kind": "captured",
    "model": "carnice:9b-q4km",
    "runtime": "ollama",
    "harness": "ollama-api-generate",
    "prompt_id": "multiple-tools-floated",
    "temperature": "0",
    "captured": "2026-06-14",
    "source": "gpu-capture-panel raw=captures/raw/2026-06-14/carnice-9b-q4km/batch20/0099-multiple-tools-floated.txt meta=captures/raw/2026-06-14/carnice-9b-q4km/batch20/0099-multiple-tools-floated.json",
    "sampler": "temperature=0,num_predict=384"
  },
  "request_tools": [
    {
      "name": "search_web",
      "description": "Search the web.",
      "parameters": {
        "type": "object",
        "properties": {
          "query": {
            "type": "string"
          }
        },
        "required": [
          "query"
        ]
      }
    },
    {
      "name": "fetch_url",
      "description": "Fetch a URL.",
      "parameters": {
        "type": "object",
        "properties": {
          "url": {
            "type": "string"
          }
        },
        "required": [
          "url"
        ]
      }
    }
  ],
  "raw_output": "{\"name\":\"search_web\",\"parameters\":{\"query\":\"Python packaging best practices 2024\"}}\n</think>\n{\"name\":\"fetch_url\",\"parameters\":{\"url\":\"https://packaging.python.org/en/latest/tutorials/packaging-projects.html\"}}",
  "taxonomy": [
    "ambiguous_tool_choice"
  ],
  "gold": {
    "type": "no_tool"
  },
  "note": "The output mentions tool use or intent in prose but contains no committed, parseable tool call; no_tool avoids fabrication."
}
