{
  "id": "0032-doc-example-tool-call",
  "provenance": {
    "kind": "synthetic",
    "model": "synthetic",
    "sampler": "n/a",
    "captured": "2026-06-14",
    "synthetic": true,
    "source": "Hand-authored negative control: documentation that shows the shape of a tool call with placeholder values, not an actual invocation."
  },
  "request_tools": [
    {
      "name": "search",
      "description": "Search the knowledge base.",
      "parameters": {
        "type": "object",
        "properties": {
          "query": {
            "type": "string"
          }
        },
        "required": [
          "query"
        ]
      }
    }
  ],
  "raw_output": "To use the search tool, send a call shaped like this:\n\n{\"name\": \"search\", \"arguments\": {\"query\": \"<your terms here>\"}}\n\nReplace <your terms here> with what you want to find.",
  "taxonomy": [
    "documentation_example"
  ],
  "gold": {
    "type": "no_tool"
  },
  "note": "This is a how-to example with a placeholder argument (<your terms here>), not a real call. The embedded object is well-formed JSON, so a naive parser will lift it into a search call with a placeholder query. no_tool is correct: the model is documenting, not invoking."
}
