{
  "id": "0047-qwen35-9b-q4km-chat-calculate-tool-intent",
  "provenance": {
    "kind": "captured",
    "model": "qwen35:9b-q4km-chat",
    "runtime": "ollama",
    "harness": "ollama-api-generate",
    "prompt_id": "calculate-tool-intent",
    "temperature": "0",
    "captured": "2026-06-14",
    "source": "gpu-capture-panel raw=captures/raw/2026-06-14/qwen35-9b-q4km-chat/batch20/0047-calculate-tool-intent.txt meta=captures/raw/2026-06-14/qwen35-9b-q4km-chat/batch20/0047-calculate-tool-intent.json",
    "sampler": "temperature=0,num_predict=384"
  },
  "request_tools": [
    {
      "name": "calculate",
      "description": "Evaluate an arithmetic expression.",
      "parameters": {
        "type": "object",
        "properties": {
          "expression": {
            "type": "string"
          }
        },
        "required": [
          "expression"
        ]
      }
    }
  ],
  "raw_output": "<think>\n\n</think>\n\n```json\n{\n  \"tool_name\": \"calculate\",\n  \"arguments\": {\n    \"expression\": \"17 * 23 + 5\"\n  }\n}\n```",
  "taxonomy": [
    "markdown_fenced_json"
  ],
  "gold": {
    "type": "tool_call",
    "name": "calculate",
    "arguments": {
      "expression": "17 * 23 + 5"
    }
  },
  "note": "The emitted text contains a complete call-like markdown_fenced_json shape naming the offered tool with all gold arguments directly recoverable."
}
