{
  "id": "0045-qwen35-9b-q4km-chat-fetch-url-tool-intent",
  "provenance": {
    "kind": "captured",
    "model": "qwen35:9b-q4km-chat",
    "runtime": "ollama",
    "harness": "ollama-api-generate",
    "prompt_id": "fetch-url-tool-intent",
    "temperature": "0",
    "captured": "2026-06-14",
    "source": "gpu-capture-panel raw=captures/raw/2026-06-14/qwen35-9b-q4km-chat/batch20/0045-fetch-url-tool-intent.txt meta=captures/raw/2026-06-14/qwen35-9b-q4km-chat/batch20/0045-fetch-url-tool-intent.json",
    "sampler": "temperature=0,num_predict=384"
  },
  "request_tools": [
    {
      "name": "fetch_url",
      "description": "Fetch a URL.",
      "parameters": {
        "type": "object",
        "properties": {
          "url": {
            "type": "string"
          }
        },
        "required": [
          "url"
        ]
      }
    }
  ],
  "raw_output": "<think>\n\n</think>\n\n{\n  \"content\": \"{\\\"fetch_url\\\": {\\\"url\\\": \\\"https://example.com/status.json\\\"}}\"\n}",
  "taxonomy": [
    "json_in_content"
  ],
  "gold": {
    "type": "tool_call",
    "name": "fetch_url",
    "arguments": {
      "url": "https://example.com/status.json"
    }
  },
  "note": "The output wraps a complete tool-call JSON string inside a content field; name and arguments are directly recoverable."
}
