{
  "id": "0058-qwen35-9b-q4km-chat-unknown-tool-mentioned",
  "provenance": {
    "kind": "captured",
    "model": "qwen35:9b-q4km-chat",
    "runtime": "ollama",
    "harness": "ollama-api-generate",
    "prompt_id": "unknown-tool-mentioned",
    "temperature": "0",
    "captured": "2026-06-14",
    "source": "gpu-capture-panel raw=captures/raw/2026-06-14/qwen35-9b-q4km-chat/batch20/0058-unknown-tool-mentioned.txt meta=captures/raw/2026-06-14/qwen35-9b-q4km-chat/batch20/0058-unknown-tool-mentioned.json",
    "sampler": "temperature=0,num_predict=384"
  },
  "request_tools": [
    {
      "name": "search_web",
      "description": "Search the web.",
      "parameters": {
        "type": "object",
        "properties": {
          "query": {
            "type": "string"
          }
        },
        "required": [
          "query"
        ]
      }
    }
  ],
  "raw_output": "<think>\nThe user wants me to search for news about open-source LLM tool calling. I should use the search_web tool with an appropriate query.\n</think>\n\n```json\n{\n  \"name\": \"search_web\",\n  \"parameters\": {\n    \"query\": \"open-source LLM tool calling news\"\n  }\n}\n```",
  "taxonomy": [
    "markdown_fenced_json"
  ],
  "gold": {
    "type": "tool_call",
    "name": "search_web",
    "arguments": {
      "query": "open-source LLM tool calling news"
    }
  },
  "note": "The emitted fenced JSON names the offered search_web tool and supplies its required query using a `parameters` field."
}
