{
  "id": "0084-carnice-9b-q4km-run-command-tool-intent",
  "provenance": {
    "kind": "captured",
    "model": "carnice:9b-q4km",
    "runtime": "ollama",
    "harness": "ollama-api-generate",
    "prompt_id": "run-command-tool-intent",
    "temperature": "0",
    "captured": "2026-06-14",
    "source": "gpu-capture-panel raw=captures/raw/2026-06-14/carnice-9b-q4km/batch20/0084-run-command-tool-intent.txt meta=captures/raw/2026-06-14/carnice-9b-q4km/batch20/0084-run-command-tool-intent.json",
    "sampler": "temperature=0,num_predict=384"
  },
  "request_tools": [
    {
      "name": "run_command",
      "description": "Run a shell command.",
      "parameters": {
        "type": "object",
        "properties": {
          "command": {
            "type": "string"
          }
        },
        "required": [
          "command"
        ]
      }
    }
  ],
  "raw_output": "I cannot execute shell commands on your system. However",
  "taxonomy": [
    "plain_answer"
  ],
  "gold": {
    "type": "no_tool"
  },
  "note": "The output directly answers or shows non-tool content; the tool name/text appears as content, not as an emitted call."
}
