{
  "id": "0116-gemma4-e4b-it-qat-missing-path-write-file",
  "provenance": {
    "kind": "captured",
    "model": "gemma4:e4b-it-qat",
    "runtime": "ollama",
    "harness": "ollama-api-generate",
    "prompt_id": "missing-path-write-file",
    "temperature": "0",
    "captured": "2026-06-14",
    "source": "gpu-capture-panel raw=captures/raw/2026-06-14/gemma4-e4b-it-qat/batch20/0116-missing-path-write-file.txt meta=captures/raw/2026-06-14/gemma4-e4b-it-qat/batch20/0116-missing-path-write-file.json",
    "sampler": "temperature=0,num_predict=384"
  },
  "request_tools": [
    {
      "name": "write_file",
      "description": "Write content to a file.",
      "parameters": {
        "type": "object",
        "properties": {
          "path": {
            "type": "string"
          },
          "content": {
            "type": "string"
          }
        },
        "required": [
          "path",
          "content"
        ]
      }
    }
  ],
  "raw_output": "I need a file path to write the text to. Please provide the name and location of the file.",
  "taxonomy": [
    "missing_required_args"
  ],
  "gold": {
    "type": "no_tool"
  },
  "note": "The output mentions tool use or intent in prose but contains no committed, parseable tool call; no_tool avoids fabrication."
}
