{
  "id": "0015-translate-partial-openai",
  "provenance": {
    "kind": "synthetic",
    "model": "synthetic",
    "sampler": "n/a",
    "captured": "2026-06-14",
    "source": "Hand-authored for toolcall-repair-bench; models the partial_openai_fields failure shape common to small local models.",
    "synthetic": true
  },
  "request_tools": [
    {
      "name": "translate_text",
      "description": "Translate text into a target language.",
      "parameters": {
        "type": "object",
        "properties": {
          "text": {
            "type": "string"
          },
          "target": {
            "type": "string"
          }
        },
        "required": [
          "text",
          "target"
        ]
      }
    }
  ],
  "raw_output": "{\"function\": {\"name\": \"translate_text\", \"arguments\": \"{\\\"text\\\": \\\"hola\\\", \\\"target\\\": \\\"en\\\"}\"}}\n",
  "taxonomy": [
    "partial_openai_fields"
  ],
  "gold": {
    "type": "tool_call",
    "name": "translate_text",
    "arguments": {
      "text": "hola",
      "target": "en"
    }
  },
  "note": "An OpenAI-ish object omits the outer type and stores arguments as a JSON string; parsing the inner function.name and double-decoding arguments yields the translate_text call with text and target verbatim."
}
