{
  "id": "0096-carnice-9b-q4km-missing-path-write-file",
  "provenance": {
    "kind": "captured",
    "model": "carnice:9b-q4km",
    "runtime": "ollama",
    "harness": "ollama-api-generate",
    "prompt_id": "missing-path-write-file",
    "temperature": "0",
    "captured": "2026-06-14",
    "source": "gpu-capture-panel raw=captures/raw/2026-06-14/carnice-9b-q4km/batch20/0096-missing-path-write-file.txt meta=captures/raw/2026-06-14/carnice-9b-q4km/batch20/0096-missing-path-write-file.json",
    "sampler": "temperature=0,num_predict=384"
  },
  "request_tools": [
    {
      "name": "write_file",
      "description": "Write content to a file.",
      "parameters": {
        "type": "object",
        "properties": {
          "path": {
            "type": "string"
          },
          "content": {
            "type": "string"
          }
        },
        "required": [
          "path",
          "content"
        ]
      }
    }
  ],
  "raw_output": "{\"name\":\"write_file\",\"arguments\":{\"path\":\"batch_twenty.txt\",\"content\":\"hello from batch twenty.\"}}",
  "taxonomy": [
    "json_in_content"
  ],
  "gold": {
    "type": "tool_call",
    "name": "write_file",
    "arguments": {
      "path": "batch_twenty.txt",
      "content": "hello from batch twenty."
    }
  },
  "note": "The emitted JSON commits to a concrete write_file call with both required arguments; the benchmark labels the emitted text, not the original prompt intent."
}
